<?xml version="1.0" encoding="UTF-8"?>
<!DOCTYPE plugin SYSTEM "../Plugin.dtd">
<plugin>
  <metadata>
    <name>Cryptix</name>
    <os>MacOs</os>
    <category>MacOs</category>
    <last_updated>1364412039000</last_updated>
    <author>Alvaro</author>
    <tags>
      <tag>tag_2</tag>
      <tag>tag_3</tag>
      <tag>tag_4</tag>
      <tag>tag_6</tag>
    </tags>
    <description>Busca trazas de la aplicacion cryptix</description>
  </metadata>
  <techniques>
    <find_file>
      <name>Cryptix.app</name>
      <location>/Principal/Applications</location>
      <recursively>false</recursively>
    </find_file>
    <find_file>
      <location>/Principal/Users</location>
      <content>Cryptix</content>
      <recursively>true</recursively>
    </find_file>
  </techniques>
</plugin>
