<?xml version="1.0" encoding="UTF-8"?>
<!DOCTYPE plugin SYSTEM "../Plugin.dtd">
<plugin>
  <metadata>
    <name>GnuPG</name>
    <os>Linux</os>
    <category>Linux</category>
    <last_updated>1364412039000</last_updated>
    <author>Alvaro</author>
    <tags>
      <tag>tag_1</tag>
      <tag>tag_2</tag>
      <tag>tag_3</tag>
      <tag>tag_7</tag>
    </tags>
    <description></description>
  </metadata>
  <techniques>
    <find_file>
      <name>gpg</name>
      <location>/usr/bin</location>
      <recursively>false</recursively>
    </find_file>
    <find_file>
      <name>gpg.1.gz</name>
      <location>/usr/share/man</location>
      <recursively>true</recursively>
    </find_file>
    <find_file>
      <location>/usr/share/man</location>
      <hash>
        <type>MD5</type>
        <value>dd49cfeb3b7f53f0521936153bd35eca</value>
      </hash>
      <recursively>true</recursively>
    </find_file>
    <find_file>
      <location>/usr/share/vin/vim73</location>
      <content>syn keyword gpgCommand  contained skipwhite nextgroup=gpgArg</content>
      <recursively>true</recursively>
    </find_file>
    <find_file>
      <location>/</location>
      <content>1024x600</content>
      <recursively>false</recursively>
      <mimetype>image/gif</mimetype>
    </find_file>
  </techniques>
</plugin>
